{
  "id": "daily-activities-v1",
  "name": "Annotation Model",
  "version": "1.1.0",
  "description": "Standard annotation model for daily activity monitoring",
  "ui_title": "Daily Activities",
  "ui_subtitle": "Select your current daily activity",
  "lastUpdated": "2026-09-04T12:00:00Z",
  "annotations": [
    {
      "id": 1,
      "id_long": "activity_sleep",
      "name": "Sleeping",
      "category": "rest",
      "description": "Deep sleep or night sleep, hours of continuous rest",
      "icon": "sleep",
      "color": "#4A90E2",
      "supports_value_entry": true,
      "value_type": "number",
      "value_labels": ["Duration"],
      "value_placeholder": "e.g. 8",
      "value_unit": "hours"

    },
    {
      "id": 2,
      "id_long": "activity_napping",
      "name": "Napping",
      "category": "rest",
      "description": "Short nap or power nap",
      "icon": "napping",
      "color": "#5DADE2",
      "supports_value_entry": true,
      "value_type": "number",
      "value_labels": ["Duration"],
      "value_placeholder": "e.g. 30",
      "value_unit": "minutes"
    },
    {
      "id": 3,
      "id_long": "activity_relaxation",
      "name": "Relaxation",
      "category": "rest",
      "description": "Relaxing or unwinding, rest, leisure activities",
      "icon": "spa",
      "color": "#9B59B6",
      "supports_value_entry": true,
      "value_type": "number",
      "value_labels": ["Duration"],
      "value_placeholder": "e.g. 15",
      "value_unit": "minutes"
    },
    {
      "id": 4,
      "id_long": "activity_sitting",
      "name": "Sitting",
      "category": "inactive",
      "description": "Sitting at desk, watching TV, etc.",
      "icon": "sitting",
      "color": "#7B68EE",
      "supports_value_entry": false
    },
    {
      "id": 5,
      "id_long": "activity_standing",
      "name": "Standing",
      "category": "inactive",
      "description": "Standing still or minimal movement, waiting, standing in place",
      "icon": "standing",
      "color": "#50E3C2",
      "supports_value_entry": false
    },
    {
      "id": 6,
      "id_long": "activity_walking",
      "name": "Walking",
      "category": "light",
      "description": "Walking at normal pace, indoor or outdoor walking",
      "icon": "walk",
      "color": "#F5A623",
      "supports_value_entry": true,
      "value_type": "number",
      "value_labels": ["Duration"],
      "value_placeholder": "e.g. 30",
      "value_unit": "minutes"
    },
    {
      "id": 7,
      "id_long": "activity_stretching",
      "name": "Stretching",
      "category": "light",
      "description": "Stretching or flexibility exercises, mobility work, warm-up",
      "icon": "stretching",
      "color": "#00CEC9",
      "supports_value_entry": true,
      "value_type": "number",
      "value_labels": ["Duration"],
      "value_placeholder": "e.g. 15",
      "value_unit": "minutes"
    },
    {
      "id": 8,
      "id_long": "activity_running",
      "name": "Running",
      "category": "intensive",
      "description": "Running or jogging",
      "icon": "run",
      "color": "#D0021B",
      "supports_value_entry": true,
      "value_type": "number",
      "value_labels": ["Duration"],
      "value_placeholder": "e.g. 15",
      "value_unit": "minutes"
    },
    {
      "id": 9,
      "id_long": "activity_cycling",
      "name": "Cycling",
      "category": "intensive",
      "description": "Riding a bicycle, stationary or outdoor cycling",
      "icon": "bike",
      "color": "#FF6B6B",
      "supports_value_entry": true,
      "value_type": "number",
      "value_labels": ["Duration"],
      "value_placeholder": "e.g. 30",
      "value_unit": "minutes"
    },
    {
      "id": 10,
      "id_long": "activity_exercise",
      "name": "Exercise",
      "category": "intensive",
      "description": "Workout or fitness training, gym, home workouts, weights",
      "icon": "dumbbell",
      "color": "#E94B3C",
      "supports_value_entry": true,
      "value_type": "number",
      "value_labels": ["Duration"],
      "value_placeholder": "e.g. 30",
      "value_unit": "minutes"
    },
    {
      "id": 11,
      "id_long": "activity_swimming",
      "name": "Swimming",
      "category": "intensive",
      "description": "Swimming or water sports",
      "icon": "swimming",
      "color": "#0984E3",
      "supports_value_entry": true,
      "value_type": "number",
      "value_labels": ["Duration"],
      "value_placeholder": "e.g. 30",
      "value_unit": "minutes"
    },
    {
      "id": 12,
      "id_long": "activity_sports",
      "name": "Sports",
      "category": "intensive",
      "description": "Playing sports or competitive activities, team sports, games",
      "icon": "volleyball",
      "color": "#FF7675",
      "supports_value_entry": true,
      "value_type": "number",
      "value_labels": ["Duration"],
      "value_placeholder": "e.g. 30",
      "value_unit": "minutes"
    },
    {
      "id": 13,
      "id_long": "activity_eating",
      "name": "Eating",
      "category": "daily",
      "description": "Having a meal or snack",
      "icon": "utensils",
      "color": "#FFD700",
      "supports_value_entry": false
    },
    {
      "id": 14,
      "id_long": "activity_working",
      "name": "Working",
      "category": "daily",
      "description": "Office work or focused tasks",
      "icon": "briefcase",
      "color": "#4ECDC4",
      "supports_value_entry": false
    },
    {
      "id": 15,
      "id_long": "activity_reading",
      "name": "Reading",
      "category": "daily",
      "description": "Reading or studying, books, articles, learning",
      "icon": "book",
      "color": "#6C5CE7",
      "supports_value_entry": false
    },
    {
      "id": 16,
      "id_long": "activity_shopping",
      "name": "Shopping",
      "category": "daily",
      "description": "Shopping or errands",
      "icon": "shopping-cart",
      "color": "#FF9FF3",
      "supports_value_entry": false
    },
    {
      "id": 17,
      "id_long": "activity_housework",
      "name": "Housework",
      "category": "daily",
      "description": "Cleaning or household tasks, tidying, organizing",
      "icon": "broom",
      "color": "#FDCB6E",
      "supports_value_entry": false
    },
    {
      "id": 18,
      "id_long": "activity_stressed",
      "name": "Stressed",
      "category": "mental",
      "description": "Feeling stressed, anxious, or frustrated",
      "icon": "alert",
      "color": "#E74C3C",
      "supports_value_entry": false
    },
    {
      "id": 19,
      "id_long": "activity_focused",
      "name": "Focused",
      "category": "mental",
      "description": "Deep focus, concentration, or meditation",
      "icon": "target",
      "color": "#3498DB",
      "supports_value_entry": false
    },
    {
      "id": 20,
      "id_long": "activity_happy",
      "name": "Happy",
      "category": "mental",
      "description": "Happy, content, calm, or peaceful state",
      "icon": "smile",
      "color": "#2ECC71",
      "supports_value_entry": false
    },
    {
      "id": 21,
      "id_long": "activity_energized",
      "name": "Energized",
      "category": "mental",
      "description": "Energized or motivated, excited, high energy",
      "icon": "zap",
      "color": "#F1C40F",
      "supports_value_entry": false
    },
    {
      "id": 22,
      "id_long": "activity_tired",
      "name": "Tired",
      "category": "mental",
      "description": "Tired, exhausted, or fatigued",
      "icon": "moon",
      "color": "#34495E",
      "supports_value_entry": false
    },
    {
      "id": 23,
      "id_long": "activity_blood_pressure",
      "name": "Blood pressure",
      "category": "health",
      "description": "Record a blood pressure measurement for the current day",
      "icon": "bp",
      "color": "#E63946",
      "measurement_type": "blood_pressure",
      "supports_value_entry": true,
      "value_type": "number/number",
      "value_labels": ["Systolic", "Diastolic"],
      "value_placeholder": "e.g. 120/80",
      "value_unit": "mmHg"
    },
    {
      "id": 24,
      "id_long": "activity_weight",
      "name": "Weight",
      "category": "health",
      "description": "Record the current body weight",
      "icon": "weight",
      "color": "#5C7CFA",
      "measurement_type": "weight",
      "supports_value_entry": true,
      "value_type": "number",
      "value_labels": ["Weight"],
      "value_placeholder": "e.g. 72.5",
      "value_unit": "kg"
    },
    {
      "id": 25,
      "id_long": "activity_heart_rate",
      "name": "Heart rate",
      "category": "health",
      "description": "Record the current heart rate",
      "icon": "heart-pulse",
      "color": "#E03131",
      "measurement_type": "heart_rate",
      "supports_value_entry": true,
      "value_type": "number",
      "value_labels": ["Heart rate"],
      "value_placeholder": "e.g. 68",
      "value_unit": "bpm"
    },
    {
      "id": 26,
      "id_long": "activity_blood_sugar",
      "name": "Blood sugar",
      "category": "health",
      "description": "Record the current blood sugar value",
      "icon": "glucose",
      "color": "#7B61FF",
      "measurement_type": "blood_sugar",
      "supports_value_entry": true,
      "value_type": "number",
      "value_labels": ["Blood sugar"],
      "value_placeholder": "e.g. 5.6",
      "value_unit": "mmol/L"
    }
  ],
  "categories": [
    {
      "id": 1,
      "id_long": "rest",
      "name": "Rest"
    },
    {
      "id": 2,
      "id_long": "inactive",
      "name": "Inactive"
    },
    {
      "id": 3,
      "id_long": "light",
      "name": "Light Activity"
    },
    {
      "id": 4,
      "id_long": "intensive",
      "name": "Intensive"
    },
    {
      "id": 5,
      "id_long": "daily",
      "name": "Daily Tasks"
    },
    {
      "id": 6,
      "id_long": "mental",
      "name": "Mental State"
    },
    {
      "id": 7,
      "id_long": "health",